{
  "format": "canvas-render-eval-expectations-v1",
  "case_id": "proposal-review/accept",
  "initial_model": {
    "components": [
      {
        "id": "welcome",
        "title": "A rough direction",
        "body": "Keep this message clear.",
        "color": "#6366f1"
      },
      {
        "id": "details",
        "title": "Supporting detail",
        "body": "Preserve unrelated content.",
        "color": "#14b8a6"
      }
    ]
  },
  "checkpoints": [
    {
      "checkpoint_id": "seed-fixture-cp",
      "after_action_id": "seed-fixture",
      "expected_action_status": "succeeded",
      "expected_events": {
        "sequence": [],
        "allow_additional": true
      },
      "expected_model": {
        "components": [
          {
            "id": "welcome",
            "title": "A rough direction",
            "body": "Keep this message clear.",
            "color": "#6366f1"
          },
          {
            "id": "details",
            "title": "Supporting detail",
            "body": "Preserve unrelated content.",
            "color": "#14b8a6"
          }
        ]
      },
      "invariants": [],
      "live_checkpoints": [
        {
          "phase": "after",
          "expected_ui": {
            "selected_component_id": "welcome",
            "selected_scenario_id": "human-edit",
            "connection": "connected",
            "running": false
          },
          "invariants": []
        }
      ]
    },
    {
      "checkpoint_id": "stage-proposal-cp",
      "after_action_id": "stage-proposal",
      "expected_action_status": "succeeded",
      "expected_events": {
        "sequence": [
          "model.request_prepared",
          "model.response_received",
          "workspace.proposal_staged"
        ],
        "allow_additional": true
      },
      "expected_model": {
        "components": [
          {
            "id": "welcome",
            "title": "A rough direction",
            "body": "Keep this message clear.",
            "color": "#6366f1"
          },
          {
            "id": "details",
            "title": "Supporting detail",
            "body": "Preserve unrelated content.",
            "color": "#14b8a6"
          }
        ]
      },
      "invariants": [],
      "live_checkpoints": [
        {
          "phase": "after",
          "expected_ui": {
            "selected_component_id": "welcome",
            "selected_scenario_id": "human-edit",
            "connection": "connected",
            "running": false,
            "proposal": {
              "status": "pending"
            },
            "status": {
              "tone": "pending"
            }
          },
          "invariants": []
        }
      ]
    },
    {
      "checkpoint_id": "decide-proposal-cp",
      "after_action_id": "decide-proposal",
      "expected_action_status": "succeeded",
      "expected_events": {
        "sequence": [
          "workspace.edit_committed"
        ],
        "allow_additional": true
      },
      "expected_model": {
        "components": [
          {
            "id": "welcome",
            "title": "Build together",
            "body": "Keep this message clear.",
            "color": "#6366f1"
          },
          {
            "id": "details",
            "title": "Supporting detail",
            "body": "Preserve unrelated content.",
            "color": "#14b8a6"
          }
        ]
      },
      "invariants": [],
      "live_checkpoints": [
        {
          "phase": "after",
          "expected_ui": {
            "selected_component_id": "welcome",
            "selected_scenario_id": "human-edit",
            "connection": "connected",
            "running": false,
            "proposal": {
              "status": "none"
            }
          },
          "invariants": []
        }
      ]
    }
  ],
  "final_checkpoint_id": "decide-proposal-cp"
}
