{
  "format": "canvas-render-eval-expectations-v1",
  "case_id": "coordinated-change/two-cards",
  "initial_model": {
    "components": [
      {
        "id": "card-a",
        "title": "Launch plan",
        "body": "Keep the launch focused.",
        "color": "#6366f1"
      },
      {
        "id": "card-b",
        "title": "Research notes",
        "body": "Interview five customers.",
        "color": "#14b8a6"
      }
    ]
  },
  "checkpoints": [
    {
      "checkpoint_id": "seed-fixture-checkpoint",
      "after_action_id": "seed-fixture",
      "expected_action_status": "succeeded",
      "expected_events": {
        "sequence": [
          "workspace.edit_committed"
        ],
        "allow_additional": true
      },
      "expected_model": {
        "components": [
          {
            "id": "card-a",
            "title": "Launch plan",
            "body": "Keep the launch focused.",
            "color": "#6366f1"
          },
          {
            "id": "card-b",
            "title": "Research notes",
            "body": "Interview five customers.",
            "color": "#14b8a6"
          }
        ]
      },
      "invariants": [],
      "live_checkpoints": [
        {
          "phase": "after",
          "expected_ui": {
            "selected_component_id": "card-a",
            "selected_scenario_id": "human-edit",
            "connection": "connected",
            "running": false
          },
          "invariants": []
        }
      ]
    },
    {
      "checkpoint_id": "exercise-cuj-checkpoint",
      "after_action_id": "exercise-cuj",
      "expected_action_status": "succeeded",
      "expected_events": {
        "sequence": [
          "workspace.edit_committed"
        ],
        "allow_additional": true
      },
      "expected_model": {
        "components": [
          {
            "id": "card-a",
            "title": "Focused launch",
            "body": "Keep the launch focused.",
            "color": "#6366f1"
          },
          {
            "id": "card-b",
            "title": "Research notes",
            "body": "Interview eight customers.",
            "color": "#14b8a6"
          }
        ]
      },
      "invariants": [
        {
          "scope": "model",
          "operator": "exists",
          "path": "/components/0/id"
        },
        {
          "scope": "model",
          "operator": "equals",
          "path": "/components/0/id",
          "value": "card-a"
        }
      ],
      "live_checkpoints": [
        {
          "phase": "after",
          "expected_ui": {
            "selected_component_id": "card-a",
            "selected_scenario_id": "human-edit",
            "connection": "connected",
            "running": false
          },
          "invariants": []
        }
      ]
    }
  ],
  "final_checkpoint_id": "exercise-cuj-checkpoint"
}
