{
  "format": "canvas-render-eval-expectations-v1",
  "case_id": "branch/subtree",
  "initial_model": {
    "components": [
      {
        "id": "map-1",
        "kind": "mind_map",
        "rootId": "root",
        "nodes": [
          {
            "id": "root",
            "parentId": null,
            "order": 0,
            "label": "Launch plan"
          },
          {
            "id": "research",
            "parentId": "root",
            "order": 0,
            "label": "Research"
          }
        ]
      }
    ]
  },
  "checkpoints": [
    {
      "checkpoint_id": "action-1-checkpoint",
      "after_action_id": "action-1",
      "expected_action_status": "succeeded",
      "expected_events": {
        "sequence": [
          "workspace.edit_committed"
        ],
        "allow_additional": true
      },
      "expected_model": {
        "components": [
          {
            "id": "map-1",
            "kind": "mind_map",
            "rootId": "root",
            "nodes": [
              {
                "id": "root",
                "parentId": null,
                "order": 0,
                "label": "Launch plan"
              },
              {
                "id": "research",
                "parentId": "root",
                "order": 0,
                "label": "Research"
              }
            ]
          }
        ]
      },
      "invariants": [],
      "live_checkpoints": [
        {
          "phase": "after",
          "expected_ui": {
            "selected_component_id": "map-1",
            "connection": "connected",
            "running": false
          },
          "invariants": []
        }
      ]
    },
    {
      "checkpoint_id": "action-2-checkpoint",
      "after_action_id": "action-2",
      "expected_action_status": "succeeded",
      "expected_events": {
        "sequence": [
          "workspace.edit_committed"
        ],
        "allow_additional": true
      },
      "expected_model": {
        "components": [
          {
            "id": "map-1",
            "kind": "mind_map",
            "rootId": "root",
            "nodes": [
              {
                "id": "root",
                "parentId": null,
                "order": 0,
                "label": "Launch plan"
              },
              {
                "id": "research",
                "parentId": "root",
                "order": 0,
                "label": "Research"
              },
              {
                "id": "interviews",
                "parentId": "research",
                "order": 0,
                "label": "Interviews"
              }
            ]
          }
        ]
      },
      "invariants": [],
      "live_checkpoints": [
        {
          "phase": "after",
          "expected_ui": {
            "selected_component_id": "map-1",
            "connection": "connected",
            "running": false
          },
          "invariants": []
        }
      ]
    },
    {
      "checkpoint_id": "action-3-checkpoint",
      "after_action_id": "action-3",
      "expected_action_status": "succeeded",
      "expected_events": {
        "sequence": [
          "workspace.edit_committed"
        ],
        "allow_additional": true
      },
      "expected_model": {
        "components": [
          {
            "id": "map-1",
            "kind": "mind_map",
            "rootId": "root",
            "nodes": [
              {
                "id": "root",
                "parentId": null,
                "order": 0,
                "label": "Launch plan"
              },
              {
                "id": "research",
                "parentId": "root",
                "order": 0,
                "label": "Research"
              },
              {
                "id": "interviews",
                "parentId": "research",
                "order": 0,
                "label": "Interviews"
              },
              {
                "id": "synthesis",
                "parentId": "interviews",
                "order": 0,
                "label": "Synthesize findings"
              }
            ]
          }
        ]
      },
      "invariants": [],
      "live_checkpoints": [
        {
          "phase": "after",
          "expected_ui": {
            "selected_component_id": "map-1",
            "connection": "connected",
            "running": false
          },
          "invariants": []
        }
      ]
    }
  ],
  "final_checkpoint_id": "action-3-checkpoint"
}
