{
  "format": "canvas-render-eval-expectations-v1",
  "case_id": "comment-lifecycle/orphan",
  "initial_model": {
    "components": [
      {
        "id": "card-a",
        "kind": "html",
        "html": "<article data-node-id=\"root\"><h2 data-node-id=\"title\">Launch plan</h2><p data-node-id=\"body\">Keep the launch focused.</p></article>"
      }
    ]
  },
  "checkpoints": [
    {
      "checkpoint_id": "seed-fixture-checkpoint",
      "after_action_id": "seed-fixture",
      "expected_action_status": "succeeded",
      "expected_events": {
        "sequence": [
          "workspace.edit_committed"
        ],
        "allow_additional": true
      },
      "expected_model": {
        "components": [
          {
            "id": "card-a",
            "kind": "html",
            "html": "<article data-node-id=\"root\"><h2 data-node-id=\"title\">Launch plan</h2><p data-node-id=\"body\">Keep the launch focused.</p></article>"
          }
        ]
      },
      "invariants": [],
      "live_checkpoints": [
        {
          "phase": "after",
          "expected_ui": {
            "selected_component_id": "card-a",
            "selected_scenario_id": "human-edit",
            "connection": "connected",
            "running": false
          },
          "invariants": []
        }
      ]
    },
    {
      "checkpoint_id": "exercise-cuj-checkpoint",
      "after_action_id": "exercise-cuj",
      "expected_action_status": "succeeded",
      "expected_events": {
        "sequence": [
          "comment.created",
          "workspace.edit_committed"
        ],
        "allow_additional": true
      },
      "expected_model": {
        "components": [
          {
            "id": "card-a",
            "kind": "html",
            "html": "<article data-node-id=\"root\"><h2 data-node-id=\"replacement\">Launch plan</h2><p data-node-id=\"body\">Keep the launch focused.</p></article>"
          }
        ]
      },
      "invariants": [
        {
          "scope": "model",
          "operator": "exists",
          "path": "/components/0/id"
        },
        {
          "scope": "model",
          "operator": "equals",
          "path": "/components/0/id",
          "value": "card-a"
        }
      ],
      "live_checkpoints": [
        {
          "phase": "after",
          "expected_ui": {
            "selected_component_id": "card-a",
            "selected_scenario_id": "human-edit",
            "connection": "connected",
            "running": false
          },
          "invariants": []
        }
      ]
    }
  ],
  "final_checkpoint_id": "exercise-cuj-checkpoint"
}
