{
  "format": "canvas-render-eval-expectations-v1",
  "case_id": "audited-request/capture-off",
  "initial_model": {
    "components": [
      {
        "id": "welcome",
        "title": "Audit the request",
        "body": "Enable capture, then run a deterministic proposal.",
        "color": "#6366f1"
      }
    ]
  },
  "checkpoints": [
    {
      "checkpoint_id": "load-scenario-checkpoint",
      "after_action_id": "load-scenario",
      "expected_action_status": "succeeded",
      "expected_events": {
        "sequence": [
          "scenario.started"
        ],
        "allow_additional": true
      },
      "expected_model": {
        "components": [
          {
            "id": "welcome",
            "title": "Audit the request",
            "body": "Enable capture, then run a deterministic proposal.",
            "color": "#6366f1"
          }
        ]
      },
      "invariants": [],
      "live_checkpoints": [
        {
          "phase": "after",
          "expected_ui": {
            "selected_component_id": "welcome",
            "selected_scenario_id": "audited-request",
            "connection": "connected",
            "running": false
          },
          "invariants": []
        }
      ]
    },
    {
      "checkpoint_id": "agent-color-off-checkpoint",
      "after_action_id": "agent-color-off",
      "expected_action_status": "succeeded",
      "expected_events": {
        "sequence": [
          "model.request_prepared",
          "workspace.edit_committed"
        ],
        "allow_additional": true
      },
      "expected_model": {
        "components": [
          {
            "id": "welcome",
            "title": "Audit the request",
            "body": "Enable capture, then run a deterministic proposal.",
            "color": "#0d9488"
          }
        ]
      },
      "invariants": [],
      "live_checkpoints": [
        {
          "phase": "during",
          "expected_ui": {
            "selected_component_id": "welcome",
            "selected_scenario_id": "audited-request",
            "connection": "connected",
            "running": true
          },
          "invariants": []
        },
        {
          "phase": "after",
          "expected_ui": {
            "selected_component_id": "welcome",
            "selected_scenario_id": "audited-request",
            "connection": "connected",
            "running": false
          },
          "invariants": []
        }
      ]
    }
  ],
  "final_checkpoint_id": "agent-color-off-checkpoint"
}
